[
  {
    "id": "ourairports",
    "title": "OurAirports open data downloads",
    "url": "https://ourairports.com/data/",
    "license": "Public Domain",
    "licenseUrl": "https://github.com/davidmegginson/ourairports-data/blob/main/LICENSE",
    "status": "approved",
    "fields": [
      "airport identifiers",
      "airport names",
      "airport types",
      "coordinates",
      "municipality",
      "IATA codes",
      "ICAO codes"
    ],
    "notes": "Use only public civil/reference records in the default dataset. Military-only, tactical, or operationally sensitive rows require maintainer review before publication."
  },
  {
    "id": "un-locode",
    "title": "UN/LOCODE Code List",
    "url": "https://unece.org/trade/cefact/unlocode-code-list-country-and-territory",
    "license": "UNECE UN/LOCODE public code list; redistribution review required",
    "licenseUrl": "https://vocab-locode-40898c.opensource.unicc.org/terms/",
    "status": "proposed",
    "fields": [
      "UN/LOCODE identifiers",
      "transport functions",
      "location names",
      "subdivision codes",
      "coordinates",
      "status indicators"
    ],
    "notes": "Primary official source for currentness checks. The 2025-1 production package and 2026-06-16 pre-release were reviewed on 2026-07-08, but official UN terms restrict redistribution and derivative compilation, so canonical records continue to cite the approved DataHub mirror until terms are cleared."
  },
  {
    "id": "datahub-un-locode",
    "title": "DataHub UN/LOCODE codelist",
    "url": "https://datahub.io/core/un-locode",
    "license": "ODC-PDDL-1.0",
    "licenseUrl": "https://opendatacommons.org/licenses/pddl/1-0/",
    "status": "approved",
    "fields": [
      "UN/LOCODE identifiers",
      "transport functions",
      "location names",
      "subdivision codes",
      "coordinates",
      "status indicators"
    ],
    "notes": "Convenience mirror of UNECE UN/LOCODE data used for redistributable canonical records. Syria rows were cross-checked against the official 2025-1 production package and 2026-06-16 pre-release on 2026-07-08."
  },
  {
    "id": "wikidata",
    "title": "Wikidata",
    "url": "https://www.wikidata.org/wiki/Wikidata:Licensing",
    "license": "CC0-1.0",
    "licenseUrl": "https://creativecommons.org/publicdomain/zero/1.0/",
    "status": "approved",
    "fields": ["external IDs", "names", "aliases", "coordinates", "public identifiers"],
    "notes": "Use for public identifiers and cross-checking, not as the only source for sensitive or ambiguous transport locations."
  },
  {
    "id": "geonames-sy",
    "title": "GeoNames Syrian Arab Republic Gazetteer Extract",
    "url": "https://download.geonames.org/export/dump/SY.zip",
    "license": "CC BY 4.0",
    "licenseUrl": "https://creativecommons.org/licenses/by/4.0/",
    "status": "approved",
    "fields": [
      "names",
      "alternate names",
      "feature codes",
      "coordinates",
      "administrative relationships"
    ],
    "notes": "Useful for cross-checking coordinates and names against the geography dataset."
  },
  {
    "id": "opensyria-data-geography",
    "title": "OpenSyria Data Geography",
    "url": "https://github.com/Open-Syria/data-geography",
    "license": "OpenSyria dataset compilation; upstream source licenses apply",
    "status": "approved",
    "fields": [
      "OpenSyria locality identifiers",
      "parent administrative identifiers",
      "English locality names",
      "Arabic locality names",
      "alternate locality spellings"
    ],
    "notes": "Used to cross-link transport records to reviewed OpenSyria geography localities. Do not use locality names as facility names unless the transport record itself represents that locality."
  },
  {
    "id": "hiu-syria-border-crossings",
    "title": "Border Crossings, Syria, March 2014",
    "url": "https://geodata.lib.berkeley.edu/catalog/stanford-mp665hn0245",
    "license": "Public Domain",
    "status": "approved",
    "fields": ["border crossing names", "coordinates", "source issue date"],
    "notes": "Compiled by the U.S. Department of State Humanitarian Information Unit and mirrored by Stanford/UC Berkeley GeoData. Use as stable public reference data only; do not infer live crossing status."
  },
  {
    "id": "hdx-syria-border-crossings-2015",
    "title": "Syria Border Crossings (HDX, 2015)",
    "url": "https://data.humdata.org/dataset/syria-border-crossings",
    "license": "Public Domain / No restrictions (CC0)",
    "status": "approved",
    "fields": [
      "Syrian-side border crossing names",
      "neighboring-country crossing names",
      "coordinates",
      "dataset date",
      "package metadata dates"
    ],
    "notes": "Archived HDX mirror of U.S. Department of State Humanitarian Information Unit border crossing data. Use as stable public reference data only; do not infer live crossing status."
  },
  {
    "id": "logistics-cluster-syria-access-2026-03-09",
    "title": "Syria - Border-crossings, airports and ports updates, 9 March 2026",
    "url": "https://logcluster.org/en/alerts/syria-border-crossings-airports-and-ports-updates-9-march-2026",
    "license": "Logistics Cluster Terms of Use; non-commercial humanitarian or academic use with attribution",
    "licenseUrl": "https://logcluster.org/en/terms-use",
    "status": "approved",
    "fields": [
      "border crossing status observations",
      "source crossing names",
      "country pairs",
      "source publication date"
    ],
    "notes": "Use only as dated status snapshot evidence. Do not use this source to overwrite stable crossing identity or infer live access beyond the source publication date."
  },
  {
    "id": "logistics-cluster-syria-coordination-minutes-2026-04-30",
    "title": "Syria - Coordination Meeting Minutes, 30 April 2026",
    "url": "https://logcluster.org/en/documents/syria-coordination-meeting-minutes-10-may-2026",
    "license": "Logistics Cluster Terms of Use; non-commercial humanitarian or academic use with attribution",
    "licenseUrl": "https://logcluster.org/en/terms-use",
    "status": "approved",
    "fields": [
      "border crossing status observations",
      "airport status observations",
      "port status observations",
      "source facility names",
      "source meeting date",
      "source publication date"
    ],
    "notes": "Use only as dated status snapshot evidence from the 30 April 2026 Syria coordination meeting. Do not use this source to overwrite stable location identity or infer live access beyond the meeting date."
  },
  {
    "id": "nga-world-port-index",
    "title": "NGA World Port Index (Pub 150)",
    "url": "https://msi.nga.mil/Publications/WPI",
    "license": "Public Domain (U.S. Government work)",
    "status": "approved",
    "fields": [
      "World Port Index numbers",
      "port names",
      "UN/LOCODE identifiers",
      "coordinates",
      "maritime facility characteristics"
    ],
    "notes": "Use for stable public maritime identifiers, port coordinates, and cross-checking. Do not treat WPI facility fields as live operational status."
  }
]
